page_link;page_is_about_software;page_is_software_guide;page_contains_software_guide;guide_format;guide_topic;page_content
https://www.gr.ch/DE/institutionen/verwaltung/djsg/kapo/aktuelles/medien/2008/Seiten/DE_10138.aspx;No;No;No;N/A;N/A;The page discusses a traffic garden for school children provided by the Kantonspolizei Graubünden.
https://www.gr.ch/DE/Medien/Mitteilungen/MMStaka/2009/Seiten/DE_18571.aspx;No;No;No;N/A;N/A;The page discusses the risks of large snow amounts and spring temperatures on the road network in Graubünden.
https://www.gr.ch/DE/institutionen/parlament/PV/Seiten/20130612DellaVedova13.aspx;No;No;No;N/A;N/A;The page discusses a parliamentary inquiry regarding funding for a sporting event called SkyRace.
https://www.gr.ch/DE/Medien/Mitteilungen/MMStaka/2021/Seiten/2021082201.aspx;No;No;No;N/A;N/A;The page discusses a surge in COVID-19 cases in various schools after the end of holidays.
https://www.gr.ch/DE/Medien/Mitteilungen/MMStaka/2001/Seiten/DE_14825.aspx;No;No;No;N/A;N/A;The page discusses a nationwide test alarm in Switzerland to check the functionality of over 7,000 sirens for public alerting.
https://www.gr.ch/DE/institutionen/verwaltung/djsg/kapo/praevention/verkehrspr%C3%A4vention/Seiten/vi_berufsschule.aspx;No;No;No;N/A;N/A;The page discusses traffic instruction in vocational and trade schools conducted by the police.
https://www.gr.ch/DE/Medien/Mitteilungen/MMStaka/1999/Seiten/DE_13721.aspx;No;No;No;N/A;N/A;The page discusses the organization of National Council elections in Graubünden, including the use of computers for data verification.
