page_link;page_is_about_software;page_is_software_guide;page_contains_software_guide;guide_format;guide_topic;page_content
https://www.gr.ch/DE/institutionen/verwaltung/djsg/kapo/aktuelles/medien/2010/Seiten/201005111.aspx;No;No;No;N/A;N/A;The page discusses a student traffic garden for public use, focusing on bicycle safety training.
https://www.gr.ch/DE/institutionen/verwaltung/djsg/kapo/aktuelles/medien/2016/Seiten/201603072.aspx;No;No;No;N/A;N/A;The page provides information about traffic restrictions due to the Engadin Skimarathon event.
https://www.gr.ch/DE/institutionen/verwaltung/djsg/kapo/aktuelles/medien/2017/Seiten/201703061.aspx;No;No;No;N/A;N/A;The page discusses traffic regulations for the 49th Engadin Skimarathon event.
https://www.gr.ch/DE/institutionen/verwaltung/dfg/stv/dokumentation/wegleitungen_und_merkblaetter;Yes;No;Yes;PDF;Finance and taxes;The page provides various tax guides and mentions that Adobe Reader is required for viewing the documents.
https://www.gr.ch/DE/institutionen/verwaltung/djsg/kapo/praevention/verkehrspr%C3%A4vention/Seiten/vi_oberstufe.aspx;No;No;No;N/A;N/A;The page focuses on traffic instruction for students in preparation for their moped and agricultural vehicle tests.
