page_link;page_is_about_software;page_is_software_guide;page_contains_software_guide;guide_format;guide_topic;page_content
https://www.gr.ch/DE/institutionen/parlament/PV/Seiten/DE_2006-12-06_1638.aspx;No;No;No;N/A;N/A;The page discusses the creation of legal foundations for Time-Out classes in schools.
https://www.gr.ch/DE/institutionen/verwaltung/dfg/stv/steuererklaerung/grundstueckgewinnsteuer/Seiten/wegleitungen_merkblaetter.aspx;Yes;Yes (webpage guide);No;Webpage;Finance and taxes;"The page provides guides and information on property gain tax, including a download link for tax declaration software ""SofTax GR Spezialsteuern."""
https://www.gr.ch/DE/institutionen/verwaltung/djsg/kapo/aktuelles/medien/2010/Seiten/201006243.aspx;No;No;No;N/A;N/A;The page discusses road closures during the Bündner Glarner Kantonalturnfest 2010 in Maienfeld.
https://www.gr.ch/DE/Medien/Mitteilungen/MMStaka/2001/Seiten/DE_14891.aspx;No;No;No;N/A;N/A;The page discusses new guidelines for the organization and management of small classes in schools.
https://www.gr.ch/DE/institutionen/verwaltung/ekud/anu/aktuelles/mitteilungen/Seiten/20220727_1August.aspx;N/A;N/A;N/A;N/A;N/A;Unable to retrieve content for analysis.
