page_link;page_is_about_software;page_is_software_guide;page_contains_software_guide;type_of_software_guide;page_content
https://www.ai.ch/themen/steuern/ai-tax-software/ai-tax-steuererklaerung-software-fuer-natuerliche-personen?searchterm=software;Yes;Yes (webpage guide);Yes;Webpage;The page provides information on AI-Tax, a tax declaration software for individuals in the Kanton Appenzell Innerrhoden.
https://www.ai.ch/themen/kultur-und-geschichte/kulturfoerderung/innerrhoder-kunststiftung/fuehrer-kunstlandschaft-appenzell?searchterm=anleitung;No;No;No;N/A;The page provides information about a guide to cultural and historical treasures in Appenzell Innerrhoden.
https://www.ai.ch/land-und-leute/geschichte/1930-gruendung-der-stickerei-zentrale-appenzell?searchterm=anleitung;No;No;No;N/A;The page discusses the history of hand embroidery in Appenzell Innerrhoden.
https://www.ai.ch/themen/bildung/berufsbildung/lehrbetriebe/jugendarbeitsschutz-gefaehrliche-arbeiten?searchterm=anleitung;No;No;No;N/A;The page outlines regulations and guidelines concerning dangerous work for young people in vocational training.
https://www.ai.ch/themen/natur-und-umwelt/jagd/ausgabestelle-jagdpatente/anleitung?searchterm=anleitung;No;No;No;N/A;The page provides information on the issuance of hunting licenses in Appenzell Innerrhoden.
https://www.ai.ch/themen/steuern/ai-tax-software?searchterm=software;Yes;Yes (webpage guide);Yes;Webpage;The page offers detailed information on AI-Tax, a tax declaration software for individuals.
https://www.ai.ch/themen/wirtschaft-und-arbeit/handelsregister/aktuelles/einschraenkungen-fuer-ags-mit-inhaberaktien/anleitung-einschraenkungen-mit-inhaberaktien?searchterm=anleitung;No;No;No;N/A;The page outlines legal restrictions for companies with bearer shares in Appenzell Innerrhoden.
https://www.ai.ch/themen/planen-und-bauen/geodaten-und-plaene/grundstueckinformation-oereb?searchterm=software;Yes;No;No;N/A;The page discusses the ÖREB-Portal, an official information system for public-law property restrictions.
https://www.ai.ch/themen/wirtschaft-und-arbeit/handelsregister/aktuelles/einschraenkungen-fuer-ags-mit-inhaberaktien/anleitung-einschraenkungen-mit-inhaberaktien-1?searchterm=anleitung;No;No;No;N/A;The page outlines legal restrictions for companies with bearer shares in Appenzell Innerrhoden.
