page_link;page_is_about_software;page_is_software_guide;page_contains_software_guide;guide_format;guide_topic;page_content
https://www.police.be.ch/de/start.html?newsID=539cc949-c5fb-455b-804a-ed027587f281;No;No;No;N/A;N/A;The page discusses travel recommendations for the Berner Zibelemärit event, advising the use of public transportation.
https://www.be.ch/de/start/dienstleistungen/medien/medienmitteilungen.html?newsID=26171cdc-ea92-3972-8839-4bd3241c9d5d;No;No;No;N/A;N/A;The page discusses an open day for an archaeological excavation site in Court-Chaluet, offering guided tours in German and French.
https://www.bvd.be.ch/de/start/themen/abfall/siedlungsabfaelle.html;No;No;No;N/A;N/A;The page provides information on the disposal of municipal waste, responsibilities, and guidelines for special waste types.
https://www.bvd.be.ch/de/start/dienstleistungen/newsletter-tba-update/tba-update-dezember-2022.html;No;No;No;N/A;N/A;The page discusses noise reduction measures in construction and urban planning, focusing on the importance of soundproofing in building projects.
https://www.police.be.ch/de/start.html?newsID=3ab0c863-95ae-4a70-aeff-73dc4dc05a61;No;No;No;N/A;N/A;The page discusses traffic disruptions in the Wankdorf area due to an Imagine Dragons concert and recommends using public transportation.
https://www.police.be.ch/de/start.html?newsID=650fd935-a20b-46d5-adc4-0a1ceb8e823a;No;No;No;N/A;N/A;The page discusses traffic and parking restrictions in Bern during the Zibelemärit event and recommends using public transportation.
