page_link;page_is_about_software;page_is_software_guide;page_contains_software_guide;guide_format;guide_topic;page_content
https://www.wegleitung.sv.fin.be.ch/de/start/np2022/einkommen-aus-taetigkeit/geschaeftsauto-zur-benutzung-fuer-den-arbeitsweg.html;No;No;No;N/A;N/A;Discusses the tax implications of using a company car for private purposes.
https://www.police.be.ch/de/start.html?newsID=58ff1c01-967d-4ac6-9433-8f621d00a33d;No;No;No;N/A;N/A;Recommends early arrival for a football match between FC Thun and AC Sparta Prag.
https://www.police.be.ch/de/start.html?newsID=db66ab11-7bb7-4120-98d4-b9277707cb55;No;No;No;N/A;N/A;Provides information about traffic disruptions due to the Tour de Suisse cycling event.
https://www.wegleitung.sv.fin.be.ch/de/start/np2021/einkommen-aus-taetigkeit/land-und-forstwirtschaft/allgemeine-angaben/bezeichnung-.html;No;No;No;N/A;N/A;Provides guidance on naming agricultural or forestry businesses for official purposes.
https://www.police.be.ch/de/start.html?newsID=94d3403f-e94d-472d-b190-1dcfd24e5485;No;No;No;N/A;N/A;Discusses expected high traffic due to a concert in Stade de Suisse, Bern.
