page_link;page_is_about_software;page_is_software_guide;page_contains_software_guide;guide_format;guide_topic;page_content
https://www.weu.be.ch/de/start/themen/umwelt/boden/bodenschutz-beim-bauen/bodenaufwertung.html;No;No;No;N/A;N/A;The page discusses soil improvement and related regulations.
https://www.be.ch/de/start/dienstleistungen/medien/medienmitteilungen.html?newsID=4ec8f2c8-5e44-4a9d-bc0d-13c8a4ef1427;No;No;No;N/A;N/A;The page discusses the lifting of a general fire ban in certain administrative districts.
https://www.police.be.ch/de/start.html?newsID=66c0d666-75a3-4442-b1b2-22a77d573bbc;No;No;No;N/A;N/A;The page discusses high traffic expected due to a Justin Bieber concert in Bern.
https://www.wegleitung.sv.fin.be.ch/de/start/np2021.html;No;No;No;N/A;N/A;The page provides information on filling out tax returns for the year 2021 in the Canton of Bern.
https://www.wegleitung.sv.fin.be.ch/de/start/np2019/schulden-und-schuldzinsen.html;No;No;No;N/A;N/A;The page provides guidance on declaring private debts and interest for tax purposes.
