page_link;page_is_about_software;page_is_software_guide;page_contains_software_guide;guide_format;guide_topic;page_content
https://www.wegleitung.sv.fin.be.ch/de/start/np2021/einkommen-aus-taetigkeit/selbstaendige-erwerbstaetigkeit/allgemeine-angaben/art-der-buchhaltung.html;No;No;No;N/A;N/A;The page discusses the types of accounting methods for self-employed individuals for tax purposes.
https://www.wegleitung.sv.fin.be.ch/de/start/np2021/wertschriften/steuerverzeichnis-der-bank/steuerverzeichnis-der-bank.html;No;No;No;N/A;N/A;The page outlines the requirements for a bank's tax directory, including the types of information that must be included.
https://www.wegleitung.sv.fin.be.ch/de/start/np2022/berufskosten/fahrkosten-fuer-private-motorfahrzeuge.html;No;No;No;N/A;N/A;The page provides information on tax-deductible transportation costs for private vehicles used for commuting.
https://www.wegleitung.sv.fin.be.ch/de/start/np2019/abzuege/beitraege-ahv-pk-saeule-3a/beitraege-saeule-drei-a.html;No;No;No;N/A;N/A;The page discusses the tax-deductible contributions to the 3a pillar of the Swiss pension system.
https://www.police.be.ch/de/start.html?newsID=a6a6b48a-ec25-4520-9174-13d5a8401803;No;No;No;N/A;N/A;The page informs about traffic disruptions in the Canton of Bern due to the 84th Tour de Suisse cycling event.
