page_link;page_is_about_software;page_is_software_guide;page_contains_software_guide;guide_format;guide_topic;page_content
https://www.wegleitung.sv.fin.be.ch/de/start/np2021/berufskosten/berufskosten-nebenerwerb.html;No;No;No;N/A;N/A;Discusses allowable professional costs for secondary employment in Switzerland.
https://www.wegleitung.sv.fin.be.ch/de/start/np2021/berufskosten.html;No;No;No;N/A;N/A;Provides information on deductible professional costs in Switzerland.
https://www.be.ch/de/start/dienstleistungen/medien/medienmitteilungen.html?newsID=7ea6c80b-6e6e-3aae-96ef-806263cc0287;No;No;No;N/A;N/A;Discusses a siren test in Switzerland and other local news.
https://www.wegleitung.sv.fin.be.ch/de/start/np2022/wertschriften/steuerverzeichnis-der-bank.html;No;No;No;N/A;N/A;Discusses how to declare assets and securities for tax purposes in Switzerland.
https://www.wegleitung.sv.fin.be.ch/de/start/np2021/wertschriften/obligationen-kassenscheine.html;No;No;No;N/A;N/A;Provides guidelines on declaring bonds and cash vouchers for tax purposes in Switzerland.
https://www.wegleitung.sv.fin.be.ch/de/start/np2019/stammdaten/verschiedene-angaben.html;No;No;No;N/A;N/A;Provides contact details.
