page_link;page_is_about_software;page_is_software_guide;page_contains_software_guide;guide_format;guide_topic;page_content
https://www.wegleitung.sv.fin.be.ch/de/start/np2021/einkommen-aus-taetigkeit/selbstaendige-erwerbstaetigkeit/aufwand.html;No;No;No;N/A;N/A;Discusses the distinction between tax-deductible and non-deductible expenses for self-employed individuals.
https://www.wegleitung.sv.fin.be.ch/de/start/np2022/wertschriften/diverse.html;No;No;No;N/A;N/A;Provides information on declaring various types of capital assets, including cryptocurrencies, in tax returns.
https://www.wegleitung.sv.fin.be.ch/de/start/np2020/abzuege/krankheits-und-unfallkosten.html;No;No;No;N/A;N/A;Discusses the tax-deductible medical and accident costs in Switzerland.
https://www.bkd.be.ch/de/start/themen/bildung-im-kanton-bern/weiterbildung/subventionierung-von-weiterbildung/antrag-stellen-fuer-subventionen-an-weiterbildungen/beitrag-an-beratung-von-organisationen.html;No;No;No;N/A;N/A;Provides information on how educational organizations can apply for consulting support in various areas including finance and marketing.
https://www.wegleitung.sv.fin.be.ch/de/start/np2021/einkommen-aus-taetigkeit/selbstaendige-erwerbstaetigkeit/steuerbarer-erfolg/mietwertdifferenz.html;No;No;No;N/A;N/A;Explains the difference in rental values between federal and cantonal levels in Switzerland.
