page_link;page_is_about_software;page_is_software_guide;page_contains_software_guide;guide_format;guide_topic;page_content
https://www.be.ch/de/start/dienstleistungen/medien/medienmitteilungen.html?newsID=0503a8d3-ebec-3f08-9bc3-c3c753b043a1;No;No;No;N/A;N/A;The page discusses the updated educational strategy for the Canton of Bern for the year 2009.
https://www.police.be.ch/de/start.html?newsID=955256fd-19b5-46fb-bfe9-ffb2c1a30766;No;No;No;N/A;N/A;The page informs about increased traffic due to concerts in Bern and recommends using public transportation.
https://www.police.be.ch/de/start.html?newsID=91a922c8-8a9b-43f9-a768-7ff7fc10958f;No;No;No;N/A;N/A;The page discusses traffic disruptions in the Wankdorf area due to a concert by Andreas Gabalier and recommends using public transportation.
https://www.police.be.ch/de/start.html?newsID=a3628186-c313-4e3a-9d38-6d822dbcf340;No;No;No;N/A;N/A;The page reports a car collision in Krauchthal that resulted in one person being injured and traffic disruptions.
https://www.police.be.ch/de/start.html?newsID=ad8b3b36-1a6a-4f48-a6aa-67b4b0027508;No;No;No;N/A;N/A;The page provides information about traffic disruptions due to the 30th Berner Fasnacht festival.
