page_link;page_is_about_software;page_is_software_guide;page_contains_software_guide;guide_format;guide_topic;page_content
https://www.wegleitung.sv.fin.be.ch/de/start/np2019/verschiedene-einkuenfte/weitere-nicht-steuerbare-einkuenfte/einkommen-welches-bereits-im-vereinfachten-abrechnungsverfahren.html;No;No;No;N/A;N/A;Discusses income taxed under a simplified accounting procedure.
https://www.wegleitung.sv.fin.be.ch/de/start/np2021/einkommen-aus-taetigkeit/selbstaendige-erwerbstaetigkeit/bilanz-eigenkapital/anlagevermoegen.html;No;No;No;N/A;N/A;Discusses assets that serve the business for more than twelve months, including financial assets and immaterial values.
https://www.wegleitung.sv.fin.be.ch/de/start/np2021/grundstuecke-im-privatvermoegen/mietwert-der-selbstbenutzten-liegenschaft/nutzniessung.html;No;No;No;N/A;N/A;Discusses the concept of usufruct and its implications for declaring rental value.
https://www.police.be.ch/de/start.html?newsID=d325f13b-d238-43f6-ae2e-2e5762664639;No;No;No;N/A;N/A;Discusses high traffic expected due to an Energy-Air concert in Bern.
https://www.wegleitung.sv.fin.be.ch/de/start/np2020/abzuege/behinderungsbedingte-kosten/heimaufenthalt.html;No;No;No;N/A;N/A;Discusses the tax implications of costs related to stays in care homes for disabled individuals.
