page_link;page_is_about_software;page_is_software_guide;page_contains_software_guide;guide_format;guide_topic;page_content
https://www.be.ch/de/start/dienstleistungen/medien/medienmitteilungen.html?newsID=ee962aab-f462-3d87-9960-7189c9a2bb3b;No;No;No;N/A;N/A;Discusses various administrative updates including siren tests and new regional forest plans.
https://www.wegleitung.sv.fin.be.ch/de/start/np2020/wertschriften/diverse/steuerwert.html;No;No;No;N/A;N/A;Discusses the tax value of various financial instruments and assets.
https://www.wegleitung.sv.fin.be.ch/de/start/np2021/berufskosten/fahrkosten_oev.html;No;No;No;N/A;N/A;Provides information on claiming public transport costs for commuting to work.
https://www.police.be.ch/de/start.html?newsID=e87943ba-e5f7-4db8-b7aa-5469f4a6e41d;No;No;No;N/A;N/A;Announces traffic disruptions due to a sports event in Langnau and surrounding areas.
https://www.police.be.ch/de/start.html?newsID=6e346436-9a58-4959-b38f-5abe13652b60;No;No;No;N/A;N/A;Announces traffic restrictions in Bern due to a New Year's reception event.
https://www.hbav.dij.be.ch/de/start/hb-fachthemen/methoden/gnss.html;No;Yes;No;Webpage;Maps, infrastructures and territorial planning;Discusses guidelines for the use of GNSS in official surveying and mapping.
