page_link;page_is_about_software;page_is_software_guide;page_contains_software_guide;guide_format;guide_topic;page_content
https://www.wegleitung.sv.fin.be.ch/de/start/np2021/einkommen-aus-taetigkeit/land-und-forstwirtschaft/steuerbarer-erfolg/sonstige-erfolgskorrekturen.html;No;No;No;N/A;N/A;Discusses financial corrections related to income from agricultural activities.
https://www.wegleitung.sv.fin.be.ch/de/start/np2021/einkommen-aus-taetigkeit/land-und-forstwirtschaft/allgemeine-angaben/art-der-buchhaltung.html;No;No;No;N/A;N/A;Discusses the types of accounting methods and requirements for financial reporting in agriculture.
https://www.police.be.ch/de/start.html?newsID=48b2e43a-c5d6-4528-82e4-1e8b9b2509f1;No;No;No;N/A;N/A;Announces traffic disruptions due to a sports event in Sumiswald and surrounding areas.
https://www.police.be.ch/de/start.html?newsID=1aab517f-f51b-4b7c-995f-182e70471add;No;No;No;N/A;N/A;Recommends early arrival for a football match at Stade de Suisse in Bern due to expected traffic disruptions.
https://www.police.be.ch/de/start.html?newsID=d8184ddc-5540-446c-a753-04345946f8cb;No;No;No;N/A;N/A;Announces traffic disruptions due to the Radclassic Pascal Richard cycling event in the Saanen area.
