page_link;page_is_about_software;page_is_software_guide;page_contains_software_guide;guide_format;guide_topic;page_content
https://www.wegleitung.sv.fin.be.ch/de/start/np2021/grundstuecke-im-privatvermoegen/grundstueckkosten.html;No;No;No;N/A;N/A;Discusses options for claiming costs related to private property.
https://www.wegleitung.sv.fin.be.ch/de/start/np2019/wertschriften/lotteriegewinne.html;No;No;No;N/A;N/A;Provides information on how to declare lottery and gambling winnings in tax returns.
https://www.police.be.ch/de/start.html?newsID=f2fbdf78-c2c9-4a44-8f64-35eb20757107;No;No;No;N/A;N/A;Recommends using public transport for attending a football match between FC Thun and BSC YB.
https://www.beinfo.sites.be.ch/de/start/rubriken/Zoom/zoom-202203-KI.html;Yes;No;No;N/A;N/A;Discusses the role of artificial intelligence in public administration, particularly in areas like tax assessment and traffic management.
https://www.sv.fin.be.ch/de/start/themen/frist-verlaengern/fristverlaengerung-erbschaft-schenkung.html;No;No;No;N/A;N/A;Provides information on how to extend the deadline for submitting tax returns for certain types of entities.
