page_link;page_is_about_software;page_is_software_guide;page_contains_software_guide;guide_format;guide_topic;page_content
https://www.akvb-gemeinden.bkd.be.ch/de/start/angebote-der-gemeinde/sichere-schulwege/verantwortlichkeiten.html;No;No;No;N/A;N/A;The page discusses responsibilities related to safe school routes.
https://www.gsi.be.ch/de/start/dienstleistungen/berufe/berufsbewilligungen/psychotherapeutin-und-psychotherapeut.html;No;No;No;N/A;N/A;The page provides information on the prerequisites and procedures for psychotherapists to obtain professional permits.
https://www.police.be.ch/de/start.html?newsID=4e795baf-98ae-4274-8ee5-f4d5e39d9747;No;No;No;N/A;N/A;The page informs about traffic restrictions in Bern due to the 27th Swiss Women's Run.
https://www.be.ch/de/start/dienstleistungen/medien/medienmitteilungen.html?newsID=b6ed9779-292e-32a0-8884-f764c358258a;No;No;No;N/A;N/A;The page discusses the annual testing of 1255 sirens in the Canton of Bern for emergency alerting.
https://www.wegleitung.sv.fin.be.ch/de/start/np2021/einkommen-aus-taetigkeit/land-und-forstwirtschaft/steuerbarer-erfolg.html;No;No;No;N/A;N/A;The page discusses the concept of taxable success.
