page_link;page_is_about_software;page_is_software_guide;page_contains_software_guide;guide_format;guide_topic;page_content
https://www.wegleitung.sv.fin.be.ch/de/start/np2019/einkommen-aus-taetigkeit/unselbstaendiger-erwerb/nebenerwerb.html;No;No;No;N/A;N/A;Discusses the concept of secondary employment and its implications for taxation.
https://www.police.be.ch/de/start.html?newsID=751b2660-e5a7-410b-9aac-43495bb5f2c8;No;No;No;N/A;N/A;Discusses traffic considerations for upcoming events in Biel and recommends using public transport.
https://www.police.be.ch/de/start.html?newsID=a37ffcd3-f35d-4470-84b3-53617a8ab385;No;No;No;N/A;N/A;Discusses the Gruyère Cycling Tour and its impact on traffic in the Saanenland area.
https://www.be.ch/de/start/dienstleistungen/medien/medienmitteilungen.html?newsID=b6938da7-3d18-4332-bd63-5b5bd189c8d9;No;No;No;N/A;N/A;Announces a fire and fireworks ban in forests due to high risk of wildfires.
https://www.wegleitung.sv.fin.be.ch/de/start/np2022/verschiedene-einkuenfte/renten-pensionen-waisenrenten/renten-aus-lebensversicherungen-leibrenten.html;No;No;No;N/A;N/A;Discusses the taxation of annuities from voluntary life insurance.
https://www.police.be.ch/de/start.html?newsID=8260c351-e399-4ad4-99d9-a0f4dff2bb54;No;No;No;N/A;N/A;Discusses high traffic expected due to a Rammstein concert in Bern and recommends using public transport.
