page_link;page_is_about_software;page_is_software_guide;page_contains_software_guide;guide_format;guide_topic;page_content
https://www.sv.fin.be.ch/de/start/publikationen/wegleitungen/wegleitungen-2019.html;No;No;No;N/A;N/A;The page provides tax guides for the year 2019, covering various topics such as natural persons, self-employment, and land and forestry.
https://www.hbav.dij.be.ch/de/start/hb-recht/kantonsvorgaben/nachfuehrung-amtliche-vermessung.html;No;No;No;N/A;N/A;The page discusses the official surveying and mapping regulations, including data management and costs.
https://www.police.be.ch/de/start.html?newsID=b307ad95-e41b-4c11-8670-e04dbdf1b289;No;No;No;N/A;N/A;The page discusses the 3rd and 4th stages of the Tour de Suisse 2010, including traffic disruptions and safety guidelines.
https://www.wegleitung.sv.fin.be.ch/de/start/np2021/einkommen-aus-taetigkeit/selbstaendige-erwerbstaetigkeit/aufwand/ausserordentlicher-aufwand.html;No;No;No;N/A;N/A;The page discusses accounting terms related to extraordinary, one-time, or non-operational expenses.
https://www.bauen.dij.be.ch/de/start/bauenausserhalbderbauzonen/themen-zum-bauen-ausserhalb-der-bauzonen.html;No;No;No;N/A;N/A;The page provides explanatory sheets on various topics related to construction outside of building zones.
