page_link;page_is_about_software;page_is_software_guide;page_contains_software_guide;guide_format;guide_topic;page_content
https://www.be.ch/de/start/dienstleistungen/medien/medienmitteilungen.html?newsID=ca0c72a0-d29d-3991-bfb9-9b73eebf7dd1;No;No;No;N/A;N/A;Discusses the risk of forest fires in parts of the Canton of Bern.
https://www.be.ch/de/start/dienstleistungen/medien/medienmitteilungen.html?newsID=10aefe0e-0ac6-33c7-8fda-a18c3e3e0c4a;No;No;No;N/A;N/A;Discusses new regulations for the management of nursing homes and home care services in the Canton of Bern.
https://www.police.be.ch/de/start.html?newsID=b00f0970-50e0-41fc-988e-b3d22fd5b484;No;No;No;N/A;N/A;Discusses road closures and restrictions in Bern due to a state visit.
https://www.be.ch/de/start/dienstleistungen/medien/medienmitteilungen.html?newsID=10ac4ce1-73b3-3feb-bbf5-be60650d7e15;No;No;No;N/A;N/A;Discusses two students at Gymnasium Neufeld testing positive for Covid-19 and the subsequent actions taken.
https://www.wegleitung.sv.fin.be.ch/de/start/np2019/abzuege/versicherungen-und-zinsen-auf-sparkapitalien/praemien-saeule-3b.html;No;No;No;N/A;N/A;Discusses insurance premiums for free provision (Säule 3b) aimed at financial security in old age, death, and disability.
https://www.wegleitung.sv.fin.be.ch/de/start/np2020/abzuege.html;No;No;No;N/A;N/A;Discusses various tax deductions, including those for professional training, insurance premiums, and health costs.
https://www.wegleitung.sv.fin.be.ch/de/start/np2022/verschiedene-einkuenfte/renten-pensionen-waisenrenten/renten-aus-gebundener-vorsorge-saeule3a.html;No;No;No;N/A;N/A;Discusses pensions from tied provision (Säule 3a) and their taxation.
