page_link;page_is_about_software;page_is_software_guide;page_contains_software_guide;guide_format;guide_topic;page_content
https://www.ag.ch/de/verwaltung/dgs/verbraucherschutz/chemie-biosicherheit/einsatzplanung;No;No;No;N/A;N/A;Discusses the planning and preparation for emergency situations, specifically in the context of chemical safety.
https://www.ag.ch/de/verwaltung/sk/recht/rechtsdienst/beschwerde;No;No;No;N/A;N/A;Provides information on the complaint procedure within the Canton of Aargau's administration.
https://www.ag.ch/de/verwaltung/dvi/kantonspolizei/praevention/betrug;Partially;No;No;N/A;N/A;Discusses various types of fraud, including telephone scams and online scams, with a brief mention of fake Microsoft support scams.
https://www.ag.ch/de/verwaltung/bvu/test-dynamische-inhalte?dc=58feb05c-897c-41eb-8c62-45f674124b72_de;No;No;No;N/A;N/A;Appears to be a login page for accessing electronic services of the cantonal administration.
https://www.ag.ch/de/smartserviceportal/dienstleistungen?dl=waffenerwerbsschein-beantragen-4cb753b7-736e-4f35-8c55-5a67dd8996ce_de;Partially;No;No;N/A;N/A;Provides information on how to apply for a firearms acquisition permit, mentions a software update related to layout changes in the permit.
https://www.ag.ch/de/verwaltung/bks/kultur/kulturvermittlung/kultur-macht-schule/angebote-fuer-schulklassen?dc=a5085d61-720e-4078-b953-7c556ac3de64_de;No;No;No;N/A;N/A;Describes a workshop on graffiti and street art, including its history and techniques, for school classes.
https://www.ag.ch/de/verwaltung/bvu/test-dynamische-inhalte?dc=721ac306-c39b-46f6-8116-dcf8a0280080_de;No;No;No;N/A;N/A;Appears to be another login page for accessing electronic services of the cantonal administration.
