page_link;page_is_about_software;page_is_software_guide;page_contains_software_guide;guide_format;guide_topic;page_content
https://www.ag.ch/de/aktuell/medien/medienmitteilungen?mm=erfolgreiches-standortmarketing-0fa2a678-c338-4ff0-9cff-4fb227f61e3b_de;Yes;No;No;N/A;N/A;Discusses the success of Aargau's location marketing, including the establishment of new companies like the software company Compuware AG.
https://www.ag.ch/de/verwaltung/dgs/militaer-bevoelkerungsschutz/bevoelkerungsschutz/katastrophenvorsorge-(katavo)/verhaltensempfehlungen/kkw-stoerfall/evakuierung;No;No;No;N/A;N/A;Provides guidelines for evacuation, including what to do before leaving the house and what to take with you.
https://www.ag.ch/de/aktuell/medien/medienmitteilungen?mm=mehr-als-600%27000-franken-fuer-gemeinnuetzige-projekte-6cdd0a6a-468c-42d2-a939-276d449aabef_de;No;No;No;N/A;N/A;Discusses funding for various community projects, including arts and culture.
https://www.ag.ch/de/aktuell/medien/medienmitteilungen?mm=gerichtsurteil-erfordert-anpassung-der-steuerlichen-liegenschaftsbewertung-im-kanton-aargau-3335f287-c13a-4842-9063-4a8ec1d08ccc_de;No;No;No;N/A;N/A;Discusses the need for adjustments in property tax assessment in the Canton of Aargau due to a court ruling.
https://www.ag.ch/de/aktuell/medien/medienmitteilungen?mm=fachhochschule-aargau-gewinnt-europaeischen-award-534f5bb1-b753-481e-9633-8fde595ec5b1_de;Yes;Yes;No;Web-based course;Education;"Discusses an award-winning e-Learning course ""FE Transfer"" for Finite Element Method (FEM) in structural mechanics and machine engineering, developed by Fachhochschule Aargau."
