page_link;explanation;software_name
https://www.ag.ch/de/verwaltung/dfr/landwirtschaft/direktzahlungen-beitraege/datenerhebung-termine/agrigis;The page provides detailed information and guides on how to use agriGIS for data collection in agriculture.;agriGIS, Agate, AgriPortal
https://www.ag.ch/de/verwaltung/dfr/geoportal/geodaten/kartendownload;The page offers ZIP files containing EMF files that can be edited in text processing software like OfficeWord or OpenOffice.;OfficeWord, OpenOffice
https://www.ag.ch/de/verwaltung/bvu/umwelt-natur-landschaft/umwelt/erdwaermenutzung/eignungskarte-erdwaerme;The page discusses the iEWS online tool for site analysis and application creation for geothermal energy use.;iEWS
https://www.ag.ch/de/verwaltung/bvu/umwelt-natur-landschaft/hochwasserschutz-gewaesser/gefahrenkarte-hochwasser;The page provides information on flood risk and hazard maps, as well as an online event register for natural hazards.;"Geoportal (Online Karten), Webapplikation des Bundes ""Erstmeldung von Naturereignissen"""
https://www.ag.ch/de/verwaltung/bvu/raumentwicklung/digitale-services/eplanung-hilfe-infos/haeufig-gestellte-fragen;The page provides comprehensive FAQs about ePlanung, a digital service for spatial planning, and mentions the Smart Service Portal for account management.;ePlanung, Smart Service Portal
https://www.ag.ch/de/verwaltung/bvu/raumentwicklung/digitale-services/eplanung-hilfe-infos;The page serves as a hub for various resources related to ePlanung, including PDF briefs for different stakeholders.;ePlanung
https://www.ag.ch/de/verwaltung/bvu/mobilitaet-verkehr/strasseninfrastruktur/integrales-management-system-ims;"The page provides access to the ""Integrales Management System (IMS)"" for retrieving various documents related to civil engineering.";Integrales Management System (IMS)
https://www.ag.ch/de/verwaltung/bvu/bauen/baubewilligungen/ebau-aargau/ebau-haeufige-fragen-support;The page provides FAQs and support information for eBau Aargau, a digital service for building permit applications. It also mentions the Smart Service Portal for technical support.;eBau Aargau, Smart Service Portal
https://www.ag.ch/de/verwaltung/bks/kultur/kulturpflege/bibliothek-archiv/kantonsbibliothek/ausleihe-und-benutzung/swisscovery-plattform;The page provides detailed information about the Swisscovery platform, which is a national library platform bundling scientific information from over 490 libraries in Switzerland. It also mentions SWITCH edu-ID for registration.;Swisscovery, SWITCH edu-ID
