page_link;page_is_about_software;page_is_software_guide;page_contains_software_guide;guide_format;guide_topic;page_content
https://www.fr.ch/de/raum-planung-und-bau/karten-plaene-kataster-und-geomatik/dsk2-hifle-benutzerhandbuch-dsk2/dsk2-hilfe-einfuehrung-0;Yes;Yes;No;Webpage;Maps, infrastructures and territorial planning;The page is a user guide for DSK2, a software developed for Internet Explorer and Mozilla Firefox, focusing on electronic document management in the context of mapping and planning.
https://www.fr.ch/de/sjsd/pol/news/verkehrsbeschraenkungen-im-zusammenhang-mit-der-ausstellung-oldtimer-teilemarkt-in-granges-paccot;No;No;No;N/A;N/A;"The page discusses traffic restrictions related to an ""Oldtimer & Parts Market"" exhibition in Granges-Paccot."
https://bdlf.fr.ch/app/de/change_documents/2201;No;No;No;N/A;N/A;The content of the page could not be retrieved.
https://www.fr.ch/de/sjsd/pol/news/verkehrsbeschraenkungen-im-zusammenhang-mit-der-ausstellung-oldtimer-teilemarkt-in-granges-paccot-0;No;No;No;N/A;N/A;"The page is a media release about traffic restrictions for an ""Oldtimer & Parts Market"" exhibition in Granges-Paccot, similar to the previous one but dated differently."
https://www.fr.ch/de/energie-landwirtschaft-und-umwelt/luft/luftschadstoffemissionen/feuer-im-freien-oder-in-einer-holzfeuerungsanlage;No;No;No;N/A;N/A;The page provides guidelines on burning plant waste outdoors or in wood-burning facilities, emphasizing legal restrictions and environmental impact.
https://bdlf.fr.ch/app/de/change_documents/2317;No;No;No;N/A;N/A;The content of the page could not be retrieved.
https://www.fr.ch/de/articles/5000;No;No;No;N/A;N/A;The page provides documents related to the Building and Housing Register (GWR), including guidelines and a feature catalog.
https://www.fr.ch/de/sjsd/pol/news/fahrzeuglenker-nach-selbstunfall-in-duedingen-fluechtig;No;No;No;N/A;N/A;The page is a media release about a car accident in Düdingen where the driver fled the scene.
