page_link;page_is_about_software;page_is_software_guide;page_contains_software_guide;type_of_software_guide;page_content
https://www.jfs.bs.ch/fuer-sportlerinnen-und-sportler/sportangebote/kinder-im-vorschulalter/programm-burzelbaum-im-vorschulalter.html;No;No;No;N/A;Discusses the Burzelbaum program for pre-school children.
https://www.staatsarchiv.bs.ch/ueber-uns/engagements/taetigkeiten/vorarchiv.html;Yes;No;No;N/A;Discusses the role of the Staatsarchiv in records management.
https://www.itbs.bs.ch/dienstleistungen/it-projekte.html;Yes;No;No;N/A;Discusses the role of IT BS in managing IT projects.
https://www.bettingen.bs.ch/kultur-und-freizeit/kultur/veranstaltungen/Holzwerkstatt.html;No;No;No;N/A;Discusses a woodworking workshop for children.
https://www.staatskanzlei.bs.ch/politische-rechte/wahlen-abstimmungen/informationen/maschinenlesbare-stimmzetteln.html;Yes;No;No;N/A;Discusses the use of machine-readable ballots in elections.
