page_link;page_is_about_software;page_is_software_guide;page_contains_software_guide;guide_format;guide_topic;page_content
https://www.gbw.ch/erwachsenenbildung/gesundheit-bewegung.html/9773/offerid/865915;No;No;No;N/A;N/A;The page discusses the tradition and methods of home smudging for purification and relaxation.
https://aba.tg.ch/bevoelkerungsschutz/submenue-2.html/1189;No;No;No;N/A;N/A;The page provides information on the role and responsibilities of the Cantonal Leadership Staff in emergency situations.
https://landwirtschaftsamt.tg.ch/de/downloads-services/formulare-downloads/landschaftsqualitaet.html/8595;No;No;No;N/A;N/A;The page offers various guidelines and forms related to landscape quality in agriculture.
https://umwelt.tg.ch/gewaesserqualitaet-und-nutzung/gewaesserqualitaet/planerischer-gewaesserschutz/grundwasserschutzareale.html/12543;No;No;No;N/A;N/A;The page discusses the importance of groundwater protection areas in the context of socio-economic and climate change.
https://kunstmuseum.tg.ch/de/sammlung/texte/text.html/7916/text/10;No;No;No;N/A;N/A;The page explores the relationship between art and religion, focusing on contemporary perspectives.
https://ogd.tg.ch/ueber-uns-kontakt/kontaktformular.html/14684;No;No;No;N/A;N/A;The page is a contact form for submitting queries or feedback.
https://kesb.tg.ch/aufgaben-der-kindes-und-erwachsenenschutzbehoerde/erwachsene/vertretung-bei-medizinischen-massnahmen.html/6208;No;No;No;N/A;N/A;The page outlines the hierarchy of individuals authorized to make medical decisions for someone who is incapacitated.
