page_link;page_is_about_software;page_is_software_guide;page_contains_software_guide;guide_format;guide_topic;page_content
https://bbf.tg.ch/laufende-kurse/kursarchiv-ab-hs-202021/ateliers-hs-202122/gestalte-ein-rezeptbuch-mit-indesign-cc.html/12899;Yes;Yes;No;Webpage;Education;The page offers a course on how to create a recipe book using Adobe Indesign CC.
https://kantlab.tg.ch/services/formulare.html/2354;No;No;No;N/A;N/A;The page provides various forms and instructions related to food businesses and chemical control.
https://www.ksk.ch/portrait/infrastruktur/byod.html/4609;Yes;No;No;N/A;Education;The page discusses the BYOD policy at Kantonsschule Kreuzlingen and mentions the provision of software through a virtual environment.
https://energieinschulen.tg.ch/news-energie-in-schulen/detailseite.html/9197/news/32961/newsarchive/1;No;No;No;N/A;N/A;The page discusses an educational kit for teaching about energy, featuring experiments and activities for students.
https://forstamt.tg.ch/publikationen/externe-publikationen.html/11272;No;No;No;N/A;N/A;The page provides external publications related to forest conservation, including videos and flyers.
https://informatik.tg.ch/html/3126;Yes;No;No;N/A;E-governance and administration;The page describes the Amt für Informatik as the central IT service for the Cantonal Administration of Thurgau, focusing on ICT security and services.
https://www.ksk.ch/an-die-kanti/aufnahmeverfahren/rechtliche-grundlagen.html/7457;No;No;No;N/A;N/A;The page provides information on the legal requirements and procedures for admission to the Gymnasiale Maturitätsschule.
