page_link;page_is_about_software;page_is_software_guide;page_contains_software_guide;guide_format;guide_topic;page_content
https://kantlab.tg.ch/services/downloads.html/2353;No;No;No;N/A;N/A;The page provides various downloads related to food hygiene, water analysis, and chemical control.
https://energie.tg.ch/gesetzliche-grundlagen/neues-energierecht-ab-1-juli-2020/grossverbraucher.html/842;No;No;No;N/A;N/A;The page discusses legal obligations for large energy consumers to optimize their energy usage.
https://steuerverwaltung.tg.ch/hilfsmittel/efisc-steuererklaerungssoftware/systemanforderungen/systemanforderungen-efisc2022.html/14115;Yes;Yes (system requirements guide);No;Webpage;Finance and taxes;The page provides system requirements for the eFisc2022 tax software.
https://bbf.tg.ch/laufende-kurse/impulsangebote-fs-2023/kreatives-modellieren-mit-marzipan.html/14395;No;No;No;N/A;N/A;The page offers a course on creative modeling with marzipan in the field of art and crafts.
https://www.tg.ch/zivil--und-strafrechtspflege/organisation/eschenz.html/207;No;No;No;N/A;N/A;The page provides information on various offices and courts responsible for the community of Eschenz in the context of civil and criminal justice.
https://landwirtschaftsamt.tg.ch/de/direktzahlungen/landschaftsqualitaetsprojekt/lq-unterthurgau.html/2034;No;No;No;N/A;N/A;The page discusses the Landscape Quality Project in Unterthurgau-Seerücken, which started in 2016 and aims to improve landscape quality.
https://bbm.tg.ch/bibliothek/digitale-bibliothek.html/6304;N/A;N/A;N/A;N/A;N/A;The page returned a 404 error, indicating that the content is not available.
