page_link;page_is_about_software;page_is_software_guide;page_contains_software_guide;guide_format;guide_topic;page_content
https://informatik.tg.ch/amt-fuer-informatik/ausbildung.html/4800;Yes;No;No;N/A;N/A;The page provides information about IT education and training.
https://jfv.tg.ch/webshop-produktbezug.html/14774;No;No;No;N/A;N/A;The page is about online purchasing of hunting and fishing licenses, with instructions for registration.
https://steuerverwaltung.tg.ch/hilfsmittel/formulare.html/10797/product/528;No;No;Yes;PDF;Finance and taxes;The page provides a PDF guide for tax forms 17, 17a, and 17b for the year 2014.
https://landwirtschaftsamt.tg.ch/de/downloads-services/formulare-downloads/kol.html/8637;No;No;Yes;Excel;Environment, agriculture and natural resources;The page provides various resources and guidelines for agricultural operations, including an Excel-based tool for crop management.
https://www.gbw.ch/erwachsenenbildung/haus-garten-gestaltung/gestalten-naehen.html/6438/offerid/627260;No;No;No;N/A;N/A;The page offers a course on crafting longboards, detailing the technical tools and machinery used in the process.
https://steuerverwaltung.tg.ch/hilfsmittel/formulare.html/10797/product/532;No;No;Yes;PDF;Finance and taxes;The page provides a PDF guide offering a brief overview of tax-related forms for the year 2013.
https://www.bza.ch/grundbildung/grundbildung/rt.html/14238;No;No;No;N/A;N/A;The page provides information about a 3-year training program for logistics professionals, detailing the skills and competencies required.
