page_link;page_is_about_software;page_is_software_guide;page_contains_software_guide;guide_format;guide_topic;page_content
https://umwelt.tg.ch/gewaesserqualitaet-und-nutzung/gewaesserqualitaet/planerischer-gewaesserschutz.html/12540;No;No;No;N/A;N/A;The page discusses the planning aspects of water protection in the cantons.
https://steuerverwaltung.tg.ch/hilfsmittel/formulare.html/10797/product/494;No;No;No;N/A;N/A;The page provides a PDF guide for the tax declaration for the year 2015.
https://energieinschulen.tg.ch/hauptrubrik-1/subnav-2.html/5368;No;No;No;N/A;N/A;The page offers educational kits for energy experiments in schools.
https://staatsanwaltschaft.tg.ch/informationen/elektronischer-rechtsverkehr.html/15315;Yes;No;No;N/A;N/A;The page outlines the requirements for electronic submissions to the prosecutor's office, including the use of qualified electronic signatures.
https://landwirtschaftsamt.tg.ch/de/direktzahlungen/landschaftsqualitaetsprojekt/lq-mittelthurgau.html/2032;No;No;No;N/A;N/A;The page discusses a landscape quality project in Mittelthurgau, focusing on agricultural measures.
https://steuerverwaltung.tg.ch/hilfsmittel/efisc-steuererklaerungssoftware/systemanforderungen/sysemanforderungen-efisc2012.html/3253;Yes;Yes (webpage guide);No;Webpage;Finance and taxes;The page provides system requirements for the eFisc2012 tax declaration software, compatible with various operating systems.
https://bbf.tg.ch/laufende-kurse/impulsangebote-fs-2023/herr-und-frau-doktor-in-den-operationssaal-bitte.html/14475;No;No;No;N/A;N/A;The page describes a two-day course where participants can learn about bone fractures and the heart, using hands-on activities.
