page_link;page_is_about_software;page_is_software_guide;page_contains_software_guide;guide_format;guide_topic;page_content
https://umwelt.tg.ch/gewaesserqualitaet-und-nutzung/gewaesserqualitaet/planerischer-gewaesserschutz/grundwasserschutzzonen.html/12542;No;No;No;N/A;N/A;The page discusses the protection zones for groundwater quality and usage.
https://naturmuseum.tg.ch/de/das-naturmuseum/sammlungen/sammlungsbereiche/botanik/neue-flora-thurgau.html/13239;No;No;No;N/A;N/A;The page focuses on the botanical collections and databases related to the flora of Thurgau.
https://wifoe.tg.ch/de/veranstaltungen.html/4265;No;No;No;N/A;N/A;The page lists various events, including economic forums and technology symposiums, but does not focus on software.
https://kantonsbibliothek.tg.ch/dienstleistungen/fremdsprachen.html/4544;No;No;No;N/A;N/A;The page offers information on foreign language media and online language courses available at the Kantonsbibliothek, but does not focus on software.
https://www.tg.ch/zivil--und-strafrechtspflege/organisation/buerglen.html/200;No;No;No;N/A;N/A;The page provides information on legal and judicial offices responsible for the community of Bürglen, including electronic submission guidelines for legal processes.
https://www.tg.ch/zivil--und-strafrechtspflege/organisation/bussnang.html/201;No;No;No;N/A;N/A;The page provides information on legal and judicial offices responsible for the community of Bussnang, including electronic submission guidelines for legal processes.
https://www.kanti-frauenfeld.ch/fachmittelschule/faecher/freikurse.html/11548;No;No;No;N/A;N/A;The page offers information on elective courses available at Kanti Frauenfeld, covering areas like music, sports, and languages, but does not focus on software.
