page_link;page_is_about_software;page_is_software_guide;page_contains_software_guide;guide_format;guide_topic;page_content
https://www.kanti-frauenfeld.ch/fachmittelschule/fachmaturitaet/unterlagen-fachmaturitaet-paedagogik-202324-fuer-fachmaturandinnenfachmaturanden.html/14517;No;No;No;N/A;N/A;The page provides information and guidelines for future students of the Fachmatura Pädagogik program for the year 2023/24.
https://kantonsbibliothek.tg.ch/dienstleistungen/suchhilfe.html/11055;No;No;No;N/A;N/A;The page offers tips and tricks for using the library's online catalog, including how to extend loan periods and pay fees online.
https://www.bztf.ch/bg/berufe/automatiker.html/6505;Yes;No;No;N/A;N/A;The page describes the role and educational requirements for becoming an Automatiker, who develops, manufactures, or maintains electrical controls and has competencies in programming.
https://av.tg.ch/themen/schule-und-digitalitaet.html/13233;Yes;No;No;N/A;N/A;The page discusses the implementation of a digital strategy in schools, including the introduction of a media and computer science curriculum.
https://sportamt.tg.ch/sitemap.html/1085;No;No;No;N/A;N/A;The page serves as a sitemap for the Sportamt website, providing an overview of various topics related to sports and physical activities.
https://raumentwicklung.tg.ch/themen/bauen-ausserhalb-bauzonen/hobbymaessige-tierhaltung.html/4224;No;No;No;N/A;N/A;The page provides guidelines for hobbyist animal keeping, specifying the conditions under which buildings can be used for this purpose.
https://steuerverwaltung.tg.ch/hauptrubrik-1/einkommens-und-vermoegenssteuern.html/2874;No;No;No;N/A;N/A;The page provides information on income and wealth taxes for natural persons in the Canton of Thurgau, stating that these taxes form the backbone of cantonal and municipal finances.
