page_link;page_is_about_software;page_is_software_guide;page_contains_software_guide;guide_format;guide_topic;page_content
https://www.sz.ch/finanzdepartement/steuerverwaltung/quellensteuer/tarife/quellensteuer-tarife-2018.html/10455;No;No;No;N/A;N/A;The page provides information on tax rates for withholding tax in the Canton of Schwyz for the year 2020.
https://www.sz.ch/finanzdepartement/steuerverwaltung/natuerliche-personen/online-schalter/steuererklaerungs-software.html/10395;Yes;Yes (webpage guide);No;Webpage;Finance and taxes;The page offers information on eTax.SZ, a software for filing tax returns online and as a desktop application.
https://www.sz.ch/volkswirtschaftsdepartement/amt-fuer-landwirtschaft/beratung-und-weiterbildung/pflanzenbau/obstbau.html/11201;No;No;No;N/A;N/A;The page provides information and guidelines on fruit cultivation and plant protection in the Canton of Schwyz.
https://www.sz.ch/behoerden/justiz/verwaltungsgericht/gerichtspraktikum.html/11757;No;No;No;N/A;N/A;The page provides information on judicial internships offered by the Administrative Court of the Canton of Schwyz.
https://www.sz.ch/verwaltung/volkswirtschaftsdepartement/amt-fuer-arbeit/arbeitssicherheit-und-gesundheitsschutz/baubewilligungsverfahren.html/10929;No;No;No;N/A;N/A;The page outlines the building permit process for industrial and non-industrial businesses in the Canton of Schwyz.
https://www.sz.ch/volkswirtschaftsdepartement/amt-fuer-arbeit/arbeitssicherheit-und-gesundheitsschutz/arbeits-und-ruhezeiten/sonntagsverkauf.html/10927;No;No;No;N/A;N/A;The page details the regulations for Sunday sales and public holidays in the Canton of Schwyz.
https://www.sz.ch/verwaltung/volkswirtschaftsdepartement/amt-fuer-arbeit/arbeitssicherheit-und-gesundheitsschutz/gewerbeaufsicht.html/10932;No;No;No;N/A;N/A;The page provides information on commercial supervision, including regulations on passive smoking, gambling, and consumer credit in the Canton of Schwyz.
