page_link;page_is_about_software;page_is_software_guide;page_contains_software_guide;guide_format;guide_topic;page_content
https://www.zh.ch/de/planen-bauen/bauvorschriften/bauen-an-besonderer-lage/bauen-wald-waldrand.html;No;No;No;N/A;N/A;The page provides information on building regulations in forests and at forest edges, including legal requirements and procedures.
https://www.zh.ch/de/webangebote-entwickeln-und-gestalten/inhalt/designsystem/komponenten/karte.zhweb-noredirect.zhweb-cache.html?node-id=21161%3A184412;Yes;Yes;No;Webpage;E-governance and administration;The page provides guidelines on how to use map components in websites and web applications, including features like zoom and pin placement.
https://www.zuerich.ch/content/zh/de/index.html;No;No;No;N/A;N/A;The page serves as an official portal for the city of Zürich, providing information on tourism, living, and the economy.
https://www.zh.ch/de/umwelt-tiere/umweltschutz/umweltpraxis/definitionsseite/2009/59/zup059_2009_a0024_raum_landschaft-pdf.html;No;No;No;N/A;N/A;The page discusses the ongoing comprehensive review of the cantonal development plan, focusing on spatial planning.
https://www.zh.ch/de/umwelt-tiere/luft-strahlung/luftqualitaet-auswirkungen.html;No;No;No;N/A;N/A;The page discusses the quality of air in Zürich, its impact on health, and measures for improvement.
https://www.zh.ch/de/wirtschaft-arbeit/wirtschaftsstandort/innovation-sandbox/leitfaden-autonome-systeme.html;Yes;Yes;No;Webpage;Social and public security;The page serves as a guide for manufacturers and private individuals interested in developing autonomous systems, focusing on legal and regulatory aspects.
https://www.zh.ch/de/mobilitaet/fahrzeuge-kontrollschilder/fahrzeugpruefungen.html;No;No;No;N/A;N/A;The page provides comprehensive information on vehicle inspections, including the types of inspections, procedures, and requirements.
