page_link;page_is_about_software;page_is_software_guide;page_contains_software_guide;guide_format;guide_topic;page_content
https://www.zh.ch/de/politik-staat/gesetze-beschluesse/rekursentscheide/rekursentscheide-definition/0331.html;No;No;No;N/A;N/A;Discusses whether changing time is considered work time according to various laws and regulations.
https://www.zh.ch/de/soziales/sozialhilfe/sozialhilfehandbuch/flexdata-definition/17-ansprueche-gegenueber-dritten/17-1-eheliche-und-partnerschaftliche-unterhaltspflicht/17-1-01-eheliche-und-partnerschaftliche-unterhaltspflicht--allgemeine-ausfuehrungen.html;No;No;No;N/A;N/A;Discusses marital and partnership maintenance obligations under various articles of law.
https://www.zh.ch/de/soziales/sozialhilfe/sozialhilfehandbuch/flexdata-definition/9-einkommen--vermoegen-wsh/9-1-einkommen/9-1-01-anrechnung-von-einkommen.html;No;No;No;N/A;N/A;Discusses the principles of income assessment for social assistance.
https://www.zh.ch/de/arbeiten-beim-kanton/fuer-hr-profis/handbuch-personalrecht/definition/sozialversicherungen/unfallversicherung.html;No;No;No;N/A;N/A;Provides guidelines and forms related to accident insurance for HR professionals and supervisors.
https://www.zh.ch/de/gesundheit/chemikalien/chemikalienrecht/aenderungen-2022-chemikalienrecht.html;No;No;No;N/A;N/A;Discusses changes in chemical regulations for 2022, including labeling and safety data sheets.
https://www.zh.ch/de/bildungsdirektion/generalsekretariat-der-bildungsdirektion/bildungsrat/suche-bildungsratsbeschluesse/2018-brb-24-volksschule-bildungsraetliche-kommission-bildungsstandards-und-lehrplan.html;No;No;No;N/A;N/A;Discusses the dissolution of a commission related to educational standards and curriculum.
https://www.zh.ch/de/politik-staat/gesetze-beschluesse/gesetzessammlung/zhlex-ls/erlass-254_2-1920_06_18-1920_06_25-000.html;No;No;No;N/A;N/A;Discusses guidelines for the treatment of public waters, roads, and forests during land registry surveys in the Canton of Zürich.
