page_link;page_is_about_software;page_is_software_guide;page_contains_software_guide;guide_format;guide_topic;page_content
https://www.zh.ch/de/steuern-finanzen/steuern/quellensteuer/quellensteuer-abrechnen/papierabrechnung.html;No;No;No;N/A;N/A;The page provides information on how to handle withholding tax in the Canton of Z端rich.
https://www.zh.ch/de/planen-bauen/tiefbau/strassenanlagen/verkehrstechnik.html;No;No;No;N/A;N/A;The page discusses traffic engineering and road infrastructure in the Canton of Z端rich.
https://www.zh.ch/de/politik-staat/gesetze-beschluesse/rekursentscheide/rekursentscheide-definition/0335.html;No;No;No;N/A;N/A;The page discusses a legal decision regarding conditional release in criminal law and does not contain any software-related guides or links.
https://www.zh.ch/de/arbeiten-beim-kanton/fuer-hr-profis/handbuch-personalrecht/definition/beendigung-arbeitsverhaeltnis/tod-von-mitarbeitenden/lohn-sterbemonat-und-lohnnachgenuss-weisung.html;No;No;No;N/A;N/A;The page provides guidelines on the payment of salaries and benefits to the families of deceased employees.
https://www.zh.ch/de/migration-integration/integration/integrationsagenda/akkreditierung-von-foerdermassnahmen.html;No;No;No;N/A;N/A;The page provides information on the accreditation process for integration programs for refugees.
https://www.zh.ch/de/umwelt-tiere/luft-strahlung/luftschadstoffquellen/emissionen-verkehr/verkehr_umwelt.html;No;No;No;N/A;N/A;The page discusses strategies for reducing the environmental impact of traffic in the Canton of Z端rich.
https://www.zh.ch/de/migration-integration/integration/integrationsangebote/integrationsangebote-definition/deutsch-und-integrationskurs-fuer-fremdsprachige-frauen-und-muetter-mit-wohnsitz-in-fehraltorf.html;No;No;No;N/A;N/A;The page describes a German and integration course for foreign-speaking women and mothers in Fehraltorf, including childcare services.
https://www.zh.ch/de/sicherheitsdirektion/kantonspolizei-zuerich/fuehrungen.html;No;No;No;N/A;N/A;The page provides information on guided tours offered by the Kantonspolizei Z端rich, including their Kriminalmuseum and Verkehrsleitzentrale.
