page_link;page_is_about_software;page_is_software_guide;page_contains_software_guide;guide_format;guide_topic;page_content
https://zg.ch/de/news/news~_2022_1_Sehr-hohe-Coronafallzahlen--Umstellungen-im-Contact-Tracing~;No;No;No;N/A;N/A;Discusses changes in contact tracing due to high COVID-19 cases in Kanton Zug.
https://zg.ch/de/staat-politik/recherche-von-unterlagen/recherche-von-unterlagen-zur-eigenen-person/fuersorgerische-zwangsmassnahmen-und-fremdplatzierung-vor-1981;No;No;No;N/A;N/A;Discusses the history and legal aspects of coercive welfare measures in Switzerland before 1981.
https://zg.ch/de/news/news~_2020-ZUPO_4_Kanton-Zug--Sicherheit-im-Kanton-Zug---Polizeiliche-Statistik-2019~;No;No;No;N/A;N/A;Discusses the police statistics for the year 2019 in Kanton Zug, including crime rates and traffic accidents.
https://zg.ch/de/news/news~_2021_12_Mehr-Lehrvertraege-und-weniger-Praktika-in-Kitas-dank-neuer-Regelung-im-Kanton-Zug~;No;No;No;N/A;N/A;Discusses new regulations in Kanton Zug aimed at reducing the duration and number of internships in childcare centers and promoting direct entry into vocational training.
https://zg.ch/de/natur-umwelt-tiere/arten-und-lebensraeume/artenmanagement-wildtiere;No;No;No;N/A;N/A;Discusses wildlife management in Kanton Zug, including the protection and monitoring of various animal species.
https://zg.ch/de/news/news~_2019-ZUPO_9_249---Zug--Feierliche-Inpflichtnahme-2019~;No;No;No;N/A;N/A;Discusses the formal induction ceremony of new police officers in Kanton Zug for the year 2019.
https://zg.ch/de/wirtschaft-arbeit/arbeitsbedingungen/einrichtung-von-betrieben-neu-und-umbauten;No;No;No;N/A;N/A;Discusses the requirements and procedures for setting up new businesses and renovations in terms of work and accident insurance laws in Kanton Zug.
