page_link;page_is_about_software;page_is_software_guide;page_contains_software_guide;guide_format;guide_topic;page_content
https://zg.ch/de/natur-umwelt-tiere/landschaft/landschaftskonzepte;No;No;No;N/A;N/A;Discusses the landscape concepts and development plans for the Canton of Zug.
https://zg.ch/de/news/news~_2023-ZUPO_3_056---Kanton-Zug--Schockanruf-f%C3%BChrt-zum-Ziel---Telefonbetr%C3%BCger-erfolgreich~;No;No;No;N/A;N/A;Reports on a phone scam targeting seniors in the Canton of Zug.
https://zg.ch/de/news/news~_2018_7_Zum-1.-August~;No;No;No;N/A;N/A;Discusses preparations for August 1st celebrations in the context of high wildfire risk in the Canton of Zug.
https://zg.ch/de/news/news~_2021_7_Hochwasser-Kanton-Zug--Sperrung-von-Strassen-und-Wegen~;No;No;No;N/A;N/A;Discusses the high flood risk in the Canton of Zug and provides safety recommendations.
https://zg.ch/de/news/news~_2021-ZUPO_8_158---Zug--Knallkoerper-aus-Auto-geworfen~;No;No;No;N/A;N/A;Reports on an incident where young men threw firecrackers from a moving car, endangering a scooter rider.
https://zg.ch/de/gesundheitsdirektion/amt-fuer-gesundheit/pharmazeutische-abteilung;No;No;No;N/A;N/A;Provides information on the Pharmaceutical Department's role in enforcing legal requirements related to medicinal products.
https://zg.ch/de/gesundheit/verbraucherschutz/gebrauchsgegenstaende/inspektion;No;No;No;N/A;N/A;Discusses the official inspection activities to ensure consumer safety in the area of food and consumer goods.
