page_link;page_is_about_software;page_is_software_guide;page_contains_software_guide;guide_format;guide_topic;page_content
https://zg.ch/de/sicherheit/polizei/praevention;No;No;No;N/A;N/A;The page focuses on crime and traffic prevention, offering information, advice, lectures, and training to the public.
https://zg.ch/de/natur-umwelt-tiere/veterinaerwesen/tiergesundheit/bieneninspektorat;No;No;No;N/A;N/A;The page provides information on the responsibilities and procedures of the Bee Inspectorate in the event of bee diseases.
https://zg.ch/de/bildung/berufslehre/informationen-fuer-lehrbetriebe/praktika-in-kindertagesstaetten;No;No;No;N/A;N/A;The page outlines regulations for internships in childcare centers, focusing on the duration and approval requirements.
https://zg.ch/de/sicherheit/zivilschutz/ausbildungszentrum-schoenau-azs;No;No;No;N/A;N/A;The page details the training and facilities available at the Schönau Civil Protection Training Center.
https://zg.ch/de/natur-umwelt-tiere/naturgefahren/aktuelle-gefahrensituation;No;No;No;N/A;N/A;The page provides information on current natural hazards and warnings in the Canton of Zug.
https://zg.ch/de/bildung/berufslehre/qualifiaktionsverfahren;No;No;No;N/A;N/A;The page discusses the qualification procedures for vocational training, conducted in collaboration with organizations and vocational schools.
https://zg.ch/de/news/news~_2020-ZUPO_12_276---Kanton-Zug--Mit-gefaelschten-Immobilieninseraten-abgezockt~;No;No;No;N/A;N/A;The page reports on fraudulent real estate listings that deceived people into paying for non-existent properties.
