page_link;page_is_about_software;page_is_software_guide;page_contains_software_guide;type_of_software_guide;page_content
https://www.zh.ch/de/politik-staat/gesetze-beschluesse/beschluesse-des-regierungsrates/rrb/regierungsratsbeschluss-651-2019.html;Yes;No;No;N/A;"Details regarding the further development and acquisition of usage rights for ""Software Agricola"" by the Baudirektion, including a download link for the official decision (RRB-2019-0651)."
https://www.zh.ch/de/arbeiten-beim-kanton/ein-kanton-viele-moeglichkeiten/arbeiten-bei-der-baudirektion/praktikum-rechtswissenschaften.html;No;No;No;N/A;Information about legal internships within various departments of the Baudirektion in the Canton of Zürich, including details on responsibilities, contact information, and application procedures.
https://www.zh.ch/de/soziales/sozialhilfe/sozialhilfehandbuch/flexdata-definition/3-zustaendigkeit/3-1-zustaendigkeitsordnung-in-der-sozialhilfe/3-1-04-unterstuetzungszustaendigkeit-fuer-personen-des-asyl-und-fluechtlingsbereichs/versions/3.html;No;No;No;N/A;Information regarding the support responsibility for persons in the asylum and refugee sector, including legal regulations, explanations, jurisdiction, and practice aids.
https://www.zh.ch/de/familie/familienforschung.html;No;No;No;N/A;Information on family research in the Canton of Zürich, including guidelines for accessing birth, marriage, and death records, family crests, and other genealogical resources.
https://www.zh.ch/de/bildungsdirektion/generalsekretariat-der-bildungsdirektion/bildungsrat/suche-bildungsratsbeschluesse/2007-brb-20-entwicklung-einer-software-fuer-das-lesetraining-auf-der-primars.html;Yes;No;No;N/A;Details of the development of a reading training software for primary school students in the Canton of Zürich, including the project's background, objectives, structure, organization, timeline, financing, and introduction.
https://www.zh.ch/de/umwelt-tiere/tiere/jagd/fachinformationen-jagdberechtigte.html;No;No;Yes;PDF (Anleitung Benützung des elektronischen Wildbuchs);Information for hunting license holders in the Canton of Zürich, including shooting practice, wild damage prevention, wild meat hygiene, hunting operations, and the use of an electronic database for wildlife management (eFJ).
https://www.zh.ch/de/nutzungshinweise.html;No;No;No;N/A;General guidelines and terms of use for the Canton of Zürich's website, including information on liability, copyright, privacy, contact details, and technical measures for secure and uninterrupted operation.
https://www.zh.ch/de/umwelt-tiere/umweltschutz/tankanlagen/hochwasserschuzt-tankanlagen.html;No;No;No;N/A;Information on flood protection for tank and storage facilities containing hazardous liquids or substances in the Canton of Zürich, including the necessity, precautionary principle, natural hazard maps, guidelines, and contact details. Several downloadable PDF guides are available on the page, but they are related to flood protection and not software.
https://www.zh.ch/de/bildungsdirektion/generalsekretariat-der-bildungsdirektion/bildungsrat/suche-bildungsratsbeschluesse/2011-brb-14-stufenuebergreifendes-medien-und-ict-konzept-fuer-die-zuercher.html;Yes;No;No;N/A;Details of a comprehensive media and ICT concept for primary schools in the Canton of Zürich, including the development, goals, action areas, implementation in two projects, and the decision of the Education Council. The concept focuses on the integration of ICT in teaching materials, web-based learning media assessment, teacher training, and local media and ICT planning.
