page_link;page_is_about_software;page_is_software_guide;page_contains_software_guide;type_of_software_guide;page_content
https://www.zh.ch/de/sport-kultur/sport/raum-fuer-sport.html;No;No;No;N/A;The page discusses public sports facilities in the region, including support for construction, reservation systems, and guidelines for optimal utilization.
https://www.zh.ch/de/bildung/informationen-fuer-schulen/informationen-volksschule/volksschule-anstellung-arbeit/volksschule-arbeitsverhaeltnis-beginnen/anleitung-meldung-quellensteuer.html;No;No;No;N/A;The page provides instructions for reporting withholding tax for teachers and school leaders with foreign citizenship or Swiss citizenship living abroad, including the necessary documents and the process for submission.
https://www.zh.ch/de/sport-kultur/lotteriefonds/rechenschaftsbericht-rechnungsstellung.html;No;No;No;N/A;The page provides instructions for submitting an accountability report and invoicing for the Charitable Education Fund, including downloadable forms and contact information.
https://www.zh.ch/de/gesundheit/gesundheitsberufe/optometrie/bewilligung-eigenverantwortliche-taetigkeit.html;No;No;No;N/A;The page provides information on how to apply for a license to practice as an optometrist in the Canton of Zurich, including requirements, fees, and necessary documents.
https://www.zh.ch/de/migration-integration/integration/integrationsagenda/akkreditierung-von-foerdermassnahmen/reakkreditierung-branchenqualifizierung.html;No;No;No;N/A;The page is not accessible (404 error).
https://www.zh.ch/de/umwelt-tiere/luft-strahlung/radon.html;No;No;No;N/A;The page provides information about Radon, a radioactive gas, its health risks, and measures to protect against exposure in Switzerland, including regulations, guidelines for construction, and methods for measuring Radon concentration.
https://www.zh.ch/de/wirtschaft-arbeit/stellensuche-arbeitslosigkeit/anmeldung-rav-arbeitslosenkasse/anmelden-beim-rav.html;No;No;No;N/A;The page provides a guide for registering with the Regional Employment Center (RAV) in the Canton of Zurich for unemployment benefits and job search assistance, including the necessary documents, process, and contact information.
https://www.zh.ch/de/politik-staat/gesetze-beschluesse/beschluesse-des-regierungsrates/rrb/regierungsratsbeschluss-1025-2021.html;Yes;No;No;N/A;The page details a decision by the Canton of Zurich's government regarding a postulate to utilize synergies in software usage within the canton, including downloadable PDFs of the decision.
https://www.zh.ch/de/bildungsdirektion/generalsekretariat-der-bildungsdirektion/bildungsrat/suche-bildungsratsbeschluesse/2016-brb-24-ict-an-zuercher-volksschulen-2022.html;Yes;No;Yes;Webpage;The page outlines the plan for the integration of ICT in Zurich's primary schools by 2022, including the development of digital learning resources, the implementation of the ICT-Guide, and the need for infrastructure and training.
