page_link;explanation;software_name
https://www.ow.ch/_rte/publikation/3949;The page provides download links and support information for the tax software for legal entities.;Obwalden Tax
https://www.ow.ch/_rte/publikation/31438;The page provides a guide for exporting E-Bilanz CH from ABACUS for import into CleverTax.;ABACUS, CleverTax
https://www.ow.ch/_rte/onlinedienst/3964;The page details the electronic tax declaration services for natural and legal persons provided by the Canton of Obwalden.;eTax OW, Obwalden Tax
https://www.ow.ch/_rte/publikation/9885;The page provides a user manual for the online portal application regarding property revaluation.;Onlineportal Neuschätzung
https://www.ow.ch/_rte/publikation/26152;The page provides a guide for downloading and installing the Obwalden Tax software for legal entities.;Obwalden Tax
