page_link;page_is_about_software;page_is_software_guide;page_contains_software_guide;guide_format;guide_topic;page_content
https://www.awa.bs.ch/arbeitnehmende/arbeitssicherheit-gesundheitsschutz/psychische-belastung.html;No;No;No;N/A;N/A;The page discusses psychosocial stress and conflict situations at the workplace and provides resources for dealing with them.
https://www.arbeitgeber.bs.ch/einblick-in-unsere-arbeit/stories.html;No;No;No;N/A;N/A;The page features stories from employees of the Canton of Basel-Stadt, discussing their roles and experiences in various sectors.
https://www.mobilitaet.bs.ch/gesamtverkehr/verkehrslenkung.html;Yes;No;No;N/A;N/A;The page discusses traffic management tools such as signal systems, whose software is tailored for specific intersections.
https://www.mobilitaet.bs.ch/parkieren-in-basel-stadt/auto-parkieren-in-basel/parkhaeuser-und-parkleitsystem.html;Yes;No;No;N/A;N/A;The page provides information on parking facilities and a dynamic parking guidance system that directs drivers to available parking spaces.
https://www.polizei.bs.ch/verkehr/strassenverkehr/parkieren/parksmart-basel/nub_bpk.html;No;No;No;N/A;N/A;The page provides information on visitor parking permits, including their types, validity, and pricing in Basel and Riehen.
https://www.mobilitaet.bs.ch/gesamtverkehr/verkehrslenkung/wegweisung.html;No;No;No;N/A;N/A;The page provides information on road signage and guidelines for their uniform appearance to guide traffic effectively.
https://www.mobilitaet.bs.ch/motorfahrzeuge/strassennetz.html;No;No;No;N/A;N/A;The page discusses the hierarchy of roads in Basel and plans for alleviating traffic congestion, including a major highway project.
