page_link;page_is_about_software;page_is_software_guide;page_contains_software_guide;guide_format;guide_topic;page_content
https://www.sg.ch/bauen/raumentwicklung/kantonaleplanung/grundlagenzumrichtplan.html;No;No;No;N/A;N/A;The page provides various studies and reports related to regional planning and development.
https://www.sg.ch/news/sgch_kantonspolizei/2023/03/wittenbach--angebliches-delikt-kann-nicht-bestaetigt-werden.html;No;No;No;N/A;N/A;The page reports on an incident involving a 7-year-old girl and a man, which was later found to be a misunderstanding.
https://www.sg.ch/bildung-sport/volksschule/aus-dem-amt/projekte/IT-Bildungsoffensive/FAQ.html;Yes;No;No;N/A;Education;The page provides FAQs about the IT Education Initiative, focusing on digital competencies for teachers.
https://www.sg.ch/wirtschaft-arbeit/arbeitgebende/bewilligungen/arbeits--und-ruhezeiten.html;No;No;No;N/A;N/A;The page provides information on work and rest time regulations, including how to apply for work time permits.
https://www.sg.ch/politik-verwaltung/gemeinden/grundbuch/grundbuchaemter/haeufige-fragen.html;No;No;No;N/A;N/A;The page provides answers to frequently asked questions about land registry and property transfer procedures.
https://www.sg.ch/steuern-finanzen/steuern/steuerarten/gewinn-kapitalsteuer/kapitalgesellschaften.html;No;No;No;N/A;N/A;The page provides information on tax regulations for corporations, including Gewinnsteuer and Kapitalsteuer.
https://www.sg.ch/gesundheit-soziales/soziales/kinder-und-jugendliche/kindesschutz/kindesschutz-konferenz.html;No;No;No;N/A;N/A;The page discusses the St.Galler Kindesschutz-Konferenz, which focuses on the protection of vulnerable and abused children and adolescents.
