page_link;page_is_about_software;page_is_software_guide;page_contains_software_guide;guide_format;guide_topic;page_content
https://www.sg.ch/news/sgch_allgemein/2020/09/regierung-verlangt-bessere-kontaktdaten-.html;No;No;No;N/A;N/A;Discusses the increase in COVID-19 cases in Kanton St.Gallen and the measures taken by the government, including data collection in clubs and bars.
https://www.sg.ch/steuern-finanzen/steuern/elektronische-steuererklaerung/etaxes-privatpersonen/eFiling.html;Yes;Yes (webpage guide);No;Webpage;Finance and taxes;Provides information on eFiling, a fully digital method for submitting tax returns using the eTaxes software.
https://www.sg.ch/umwelt-natur/umwelt/stoerfallvorsorge---biosicherheit/stoerfallvorsorge.html;No;No;No;N/A;N/A;Discusses the management of hazardous substances and organisms, outlining the responsibilities and safety measures for businesses.
https://www.sg.ch/steuern-finanzen/steuern/elektronische-steuererklaerung/Supportanfrage.html;Yes;No;No;N/A;N/A;Provides a support request form for issues related to eTaxes software.
https://www.sg.ch/umwelt-natur/landwirtschaft/jahresberichte-merkblaetter-formulare.html;No;No;No;N/A;N/A;Offers various publications, reports, and forms related to agriculture in the Kanton St.Gallen.
https://www.sg.ch/recht/staatsanwaltschaft-jugendanwaltschaft/Berufseinstieg/laufbahnplanung-bei-der-staatsanwaltschaft-des-kantons-st-gallen.html;No;No;No;N/A;N/A;Provides career planning information for those interested in becoming a prosecutor in Kanton St.Gallen.
https://www.sg.ch/umwelt-natur/umwelt/Vollzugshilfsmittel/gemeindeaufgaben-beim-gewaesserschutz/grundwasserschutzzonen-und--areale.html;No;No;No;N/A;N/A;Discusses the responsibilities and procedures for groundwater protection zones, including legal frameworks and community roles.
