page_link;page_is_about_software;page_is_software_guide;page_contains_software_guide;guide_format;guide_topic;page_content
https://www.sg.ch/steuern-finanzen/steuern/steuerarten/grundstueckgewinnsteuer.html;No;No;No;N/A;N/A;The page provides information on the Grundstückgewinnsteuer (property gain tax) in the canton of St. Gallen, including how to calculate it and relevant forms.
https://www.sg.ch/news/sgch_allgemein/2021/11/kanton-st-gallen-baut-netz-von-defibrillatoren-weiter-aus.html;No;No;No;N/A;N/A;The page discusses the expansion of the defibrillator network in the canton of St. Gallen for public safety.
https://www.sg.ch/steuern-finanzen/steuern/steuerarten/quellensteuer/haeufig-gestellte-fragen.html;No;No;No;N/A;N/A;The page provides answers to frequently asked questions about withholding tax in the canton of St. Gallen.
https://www.sg.ch/umwelt-natur/umwelt/boden/publikationen-und-weitere-informationen.html;No;No;No;N/A;N/A;The page offers various publications and information related to soil and environmental protection in the canton of St. Gallen.
https://www.sg.ch/bildung-sport/bslb/ebiz/Interessen/9/21/0-723-28-0.html;No;No;No;N/A;N/A;The page provides information about the profession of dental technicians, including training, salary, and qualifications required.
https://www.sg.ch/news/sgch_allgemein/2022/04/aus-der-aprilsession-2022.html;No;No;No;N/A;N/A;The page provides a detailed account of the April 2022 session of the cantonal parliament of St. Gallen, covering various topics from public safety to environmental issues.
https://www.sg.ch/sicherheit/kantonspolizei/praevention--jugend--cybercrime/cybercrime.html;Yes;Yes;Yes;PDF;Social and public security;The page offers preventive tips and advice on cybercrime, including downloadable PDF guides on how to protect against various types of cyber threats.
