page_link;page_is_about_software;page_is_software_guide;page_contains_software_guide;guide_format;guide_topic;page_content
https://www.sg.ch/bauen/tiefbau/fuss--und-veloverkehr.html;No;No;No;N/A;N/A;The page is about pedestrian and bicycle traffic in St. Gallen.
https://www.sg.ch/bildung-sport/volksschule/das-st-galler-schulsystem/rekursstellen-volksschule.html;No;No;No;N/A;N/A;The page discusses the appeal procedures in the St. Gallen school system.
https://www.sg.ch/recht/beschaffungswesen/offertoeffnungen.html;No;No;Yes;PDF;Purchasing and procurement;The page provides information on tender openings for cantonal contracts and includes PDF documents related to various projects, including software procurement.
https://www.sg.ch/news/sgch_allgemein/2023/05/digitalisierungsschub-im-st-galler-bauwesen.html;Yes;No;No;N/A;N/A;The page discusses the digital transformation in St. Gallen's construction sector, including the introduction of new software for electronic building applications.
https://www.sg.ch/news/sgch_allgemein/2019/09/st-galler-mitglieder-des-hochschulrates-gewaehlt.html;No;No;No;N/A;N/A;The page discusses the election of St. Gallen members to the Hochschulrat of the new Ost – Ostschweizer Fachhochschule.
https://www.sg.ch/kultur/staatsarchiv/Spezialthemen-/auds/2021.html;Yes;No;Yes;PDF;Archives and document management;"The page discusses the 24th meeting of the Arbeitskreis ""Archivierung von Unterlagen aus digitalen Systemen"" (AUdS) and provides PDF documents on digital archiving strategies and frameworks."
https://www.sg.ch/bauen/geoinformation/gi/geodienste/einbindung.html;Yes;Yes;No;Webpage;Maps, infrastructures and territorial planning;The page provides guides on how to integrate geoservices of the Canton of St. Gallen into various GIS systems like ESRI ArcMap and QGIS.
