page_link;page_is_about_software;page_is_software_guide;page_contains_software_guide;guide_format;guide_topic;page_content
https://www.sg.ch/gesundheit-soziales/soziales/familie/familienausgleichskassen.html;No;No;No;N/A;N/A;The page discusses family allowances and the legal framework in the Canton of St. Gallen.
https://www.sg.ch/steuern-finanzen/steuern/formulare-wegleitungen.html;No;No;No;N/A;N/A;The page provides information on various types of taxes and offers downloadable PDF forms for tax-related matters.
https://www.sg.ch/news/sgch_kantonspolizei/2019/02/rorschach-rheineck--nach-unfall-vor-der-polizei-gefluechtet-und-.html;No;No;No;N/A;N/A;The page reports on a car accident involving a man who fled from the police and caused another accident.
https://www.sg.ch/news/sgch_handelsregister-notariate/2019/10/inhaberaktien-werden-abgeschafft.html;No;No;No;N/A;N/A;The page discusses the abolishment of bearer shares in Switzerland and the legal changes associated with it.
https://www.sg.ch/news/sgch_sport/2022/07/jugendsportcamp-widnau-2022.html;No;No;No;N/A;N/A;The page provides information about a youth sports camp in Widnau, detailing the activities and sports offered.
https://www.sg.ch/umwelt-natur/umwelt/Vollzugshilfsmittel/gemeindeaufgaben-beim-laermschutz/schiessanlagen.html;No;No;No;N/A;N/A;The page outlines the responsibilities of municipalities in the Canton of St. Gallen regarding noise protection at shooting ranges.
https://www.sg.ch/news/sgch_datenschutz/2022/10/merkblatt-zum-pilotversuch-veroeffentlich.html;Yes;No;No;N/A;N/A;The page discusses the importance of data processing in cloud projects and the responsibilities of public organizations in this context.
