page_link;page_is_about_software;page_is_software_guide;page_contains_software_guide;guide_format;guide_topic;page_content
https://www.sg.ch/kultur/staatsarchiv/uber-uns/historische-einblicke/2015-weihnachtsideen.html;No;No;No;N/A;N/A;The page provides historical insights into Christmas ideas and traditions.
https://www.sg.ch/umwelt-natur/wasser/grundwasser---quellen-/grundwasserschutz/ausscheidung-von-grundwasserschutzzonen-und--arealen-und-vollzug.html;No;No;No;N/A;N/A;The page discusses the regulations and procedures for groundwater protection zones and areas.
https://www.sg.ch/news/sgch_standortfoerderung/2019/12/Abacus.html;Yes;No;No;N/A;N/A;The page discusses a strategic partnership aimed at automating accounting processes through artificial intelligence.
https://www.sg.ch/kultur/kantonsbibliothek-vadiana/digitale-angebote.html;No;No;No;N/A;N/A;The page provides an overview of various digital offerings, including e-books, e-audios, and streaming services, available through the Kantonsbibliothek Vadiana.
https://www.sg.ch/wirtschaft-arbeit/pki/renewal-software.html;Yes;Yes;No;Webpage;E-governance and administration;The page provides information on the software required for reading PKI certificates and the procedures for PIN reset.
https://www.sg.ch/gesundheit-soziales/soziales/familie/pflegefamilien.html;No;No;No;N/A;N/A;The page provides information for prospective and active foster parents, including their tasks, rights, and obligations.
https://www.sg.ch/news/sgch_allgemein/2021/06/rechtliche-verfahren-kindgerecht-durchfuehren.html;No;No;No;N/A;N/A;The page discusses the importance of child-friendly legal procedures and outlines measures and recommendations for their implementation.
