page_link;page_is_about_software;page_is_software_guide;page_contains_software_guide;guide_format;guide_topic;page_content
https://www.ur.ch/_rte/dienst/6683;Yes;No;Yes;PDF;Social and public security;The page warns about fraudulent support calls claiming to be from Microsoft and offers PDF guides for prevention.
https://www.ur.ch/_rte/onlinedienst/3841;No;No;No;N/A;N/A;The page provides information on how to redeem a promo code.
https://zg.ch/de/steuern-finanzen/steuern/natuerliche-personen/steuererklaerung-ausfuellen;Yes;Yes;Yes;PDF;Finance and taxes;The page provides information on how to electronically file tax returns using eTax.zug software.
https://zg.ch/de/wirtschaft-arbeit/handelsregister/neueintragung/elektronischer-geschaeftsverkehr;Yes;Yes;No;N/A;E-governance and administration;The page provides guidelines for electronic submissions to the commercial register, including the use of electronic signatures.
https://zg.ch/de/news/news~_2021_11_Neues-Online-Portal-fuer-Lotteriefonds--und-Sportfonds-Gesuche-lanciert~;Yes;Yes;No;Video;Culture and tourism;The page announces a new online portal for lottery and sports fund applications, with a video guide for user assistance.
https://zg.ch/de/steuern-finanzen/steuern/juristische-personen/steuererklaerung-ausfuellen;Yes;Yes;Yes;PDF;Finance and taxes;The page provides guidelines on how to use eTax.zug software for filing tax returns for legal entities.
https://www.baselland.ch/politik-und-behorden/direktionen/bildungs-kultur-und-sportdirektion/dienstleistungen-und-angebote/informatik-schulen-bl/von-a-z;Yes;Yes;Yes;PDF;Education;The page provides an A-Z list of IT services and guides for schools in Basel-Landschaft, including software like Adobe Creative Cloud and Microsoft 365.
