page_link;page_is_about_software;page_is_software_guide;page_contains_software_guide;guide_format;guide_topic;page_content
https://www.baselland.ch/online-schalter/a-z;No;No;No;N/A;N/A;The page appears to be a login portal for various services offered by Kanton Basel-Landschaft. It does not focus on software or provide guides about software.
https://www.baselland.ch/politik-und-behorden/direktionen/bau-und-umweltschutzdirektion/tiefbauamt/downloads-1/signalisation-und-lichtsignalanlagen;No;No;No;N/A;N/A;The page provides various downloadable documents related to signalization and traffic light systems, but does not focus on software or provide guides about software.
https://www.baselland.ch/politik-und-behorden/direktionen/bau-und-umweltschutzdirektion/umweltschutz-energie/neobiota2;No;No;No;N/A;N/A;The page focuses on the topic of Neobiota, invasive plants and animals, and their impact on the environment. It does not pertain to software or provide guides about software.
https://www.baselland.ch/politik-und-behorden/direktionen/bildungs-kultur-und-sportdirektion/dienstleistungen-und-angebote/informatik-schulen-bl/ict-bildung/digitale-grundbildung;Yes;No;Yes;Text;Education;The page focuses on the importance of digital competencies in education, offering various downloadable materials for self-study and teaching.
https://www.baselland.ch/politik-und-behorden/direktionen/bildungs-kultur-und-sportdirektion/dienstleistungen-und-angebote/informatik-schulen-bl/ict-bildung/ict-primarschulen/unterrichtsmaterial;Yes;Yes;Yes;Text;Education;The page offers various teaching materials and plans for digital education, focusing on media and informatics for primary schools.
https://www.baselland.ch/politik-und-behorden/direktionen/bildungs-kultur-und-sportdirektion/dienstleistungen-und-angebote/informatik-schulen-bl/ict-bildung/ict-primarschulen/unterrichtsmaterial/ideenpool-ict-unterricht;Yes;Yes;Yes;Text;Education;The page provides an array of teaching ideas and resources for digital education, including topics on data protection and safe internet usage.
https://www.baselland.ch/politik-und-behorden/direktionen/bildungs-kultur-und-sportdirektion/dienstleistungen-und-angebote/informatik-schulen-bl/ict-bildung/ict-primarschulen/unterrichtsmaterial/programmieren-robotik/ausleihangebote/code-werkstatt/download-dokumente-code-werkstatt-nr-2;Yes;Yes;Yes;PDF, DOCX;Education;The page provides downloadable documents for conducting a CODE workshop, including planning, tasks, and evaluations related to programming and robotics.
