page_link;page_is_about_software;page_is_software_guide;page_contains_software_guide;guide_format;guide_topic;page_content
https://www.be.ch/de/start/dienstleistungen/medien/medienmitteilungen.html?newsID=069f9867-6c76-3721-b606-4a96997c21dd;No;No;No;N/A;N/A;Discusses the Canton of Bern's digital strategy.
https://www.be.ch/de/start/dienstleistungen/medien/medienmitteilungen.html?newsID=6099896a-2335-31d7-836d-15c6c660bed5;No;No;No;N/A;N/A;Focuses on the Canton of Bern's financial situation.
https://www.be.ch/de/start/dienstleistungen/medien/medienmitteilungen.html?newsID=6406fd0d-ea02-3f8a-af15-b4c88e80de2a;No;No;No;N/A;N/A;Addresses the Canton of Bern's COVID-19 measures.
https://www.bst.bkd.be.ch/de/start/themen/lern-arbeitstechniken/studienspezifische-techniken/arbeiten-schreiben.html;No;No;No;N/A;N/A;Provides tips and techniques for structuring the writing process for academic work.
https://www.police.be.ch/de/start/dienstleistungen/praeventionsunterricht-an-schulen.html;No;No;No;N/A;N/A;Discusses prevention education at schools, focusing on topics like road safety and digital media.
https://www.kaio.fin.be.ch/de/start/themen/rechtliche-grundlagen/publikationen.html;Yes;No;No;N/A;E-governance and administration;Provides information on legal aspects of KAIO's activities, including the use of Open Source Software in public administration.
https://www.be.ch/de/start/dienstleistungen/medien/medienmitteilungen.html?newsID=69f66c57-6973-3ca4-98e9-1faabf79337f;No;No;No;N/A;N/A;Discusses the first Berner Tourism Day in Interlaken, focusing on the current situation and future prospects of the tourism industry.
