page_link;page_is_about_software;page_is_software_guide;page_contains_software_guide;guide_format;guide_topic;page_content
https://www.raumplanung.dij.be.ch/de/start/eplan/kartenanwendung/karte-verwenden.html;No;No;No;N/A;N/A;The page provides instructions on how to use a mapping application.
https://www.kultur.bkd.be.ch/de/start/themen/kulturfoerderung/kulturvermittlung/ausserschulische-kulturvermittlung/Kulturprojekte-fruehkindliche-Bildung/anleitung-wie-stelle-ich-ein-gesuch.html;No;No;No;N/A;N/A;The page provides a guide on how to submit a request for a cultural project in the area of early childhood education.
https://www.akvb-gemeinden.bkd.be.ch/de/start/angebote-der-gemeinde/tagesschulangebote/tagesschulangebote-administrieren/gebuehren-fuer-tagesschulen.html;Yes;Yes;Yes;Webpage;Education;The page provides information on parental fees for day schools and mentions kiBon, a software for administration of these fees.
https://www.kaio.fin.be.ch/de/start/themen/rechtliche-grundlagen/ict-standards.html;Yes;No;No;N/A;N/A;The page outlines the ICT standards set by the cantonal administration for the use of software solutions and platforms.
https://www.agi.dij.be.ch/de/start/kataster/oereb-kataster/informationen-fuer-gemeinden/pruefkarte.html;No;No;No;N/A;N/A;The page provides information for municipalities on how to review data related to land use planning, noise sensitivity levels, and other topics via a Prüfkarte.
https://www.police.be.ch/de/start/dienstleistungen/informationen-fuer-gemeinden--partner--bedrohungsmanagement/fachstelle-alarmierung.html;Yes;Yes;Yes;Webpage;Communication and collaboration;The page serves as a hub for alarm systems, providing guides and information on various software like WinFAP, eAlarmPush, and DiCal.
https://www.staatsarchiv.sta.be.ch/de/start/benutzung/anleitung-recherche-im-online-inventar.html;No;Yes;No;Webpage;Archives and document management;The page provides a guide on how to conduct research in the online inventory of the State Archives.
