page_link;page_is_about_software;page_is_software_guide;page_contains_software_guide;guide_format;guide_topic;page_content
https://www.baselland.ch/politik-und-behorden/direktionen/volkswirtschafts-und-gesundheitsdirektion/amt-fur-wald/wald/bildung;No;No;No;N/A;N/A;The page is about educational programs related to forestry in the canton of Basel-Landschaft.
https://www.baselland.ch/themen/p/politische-rechte/fuer-gemeindeverwaltungen-1;No;No;No;N/A;N/A;The page provides information on political rights for local administrations in Basel-Landschaft.
https://www.baselland.ch/politik-und-behorden/direktionen/sicherheitsdirektion/polizei/bewilligungen/wegweiser;No;No;No;N/A;N/A;The page serves as a guide for obtaining various permits from the police department in Basel-Landschaft.
https://www.baselland.ch/politik-und-behorden/direktionen/bau-und-umweltschutzdirektion/raumplanung/langsamverkehr/langsamverkehr;No;No;No;N/A;N/A;The page discusses plans and measures for promoting slow traffic in Basel-Landschaft.
https://www.baselland.ch/politik-und-behorden/direktionen/bildungs-kultur-und-sportdirektion/bildung/sekundarstufe-ii/berufs-studien-und-laufbahnberatung/downloadbereich;No;No;No;N/A;N/A;The page offers downloadable resources for career, study, and path counseling for secondary level II education in Basel-Landschaft.
https://www.baselland.ch/politik-und-behorden/direktionen/volkswirtschafts-und-gesundheitsdirektion/amt-fur-geoinformation/geoportal/geodaten/geodatenprodukte/verkehr/wanderwege-esri-shapefile;No;No;No;N/A;N/A;The page provides geodata products related to hiking trails in the form of ESRI shapefiles.
https://www.baselland.ch/politik-und-behorden/direktionen/sicherheitsdirektion/polizei/wir-uber-uns/verkehr/verkehrstechnik;No;No;No;N/A;N/A;The page focuses on traffic safety measures and provides statistics for accident prevention in Basel-Landschaft.
https://www.baselland.ch/themen/c_d/chronik-baselland/chronik-ab-2020/chronik-september-2020;No;No;No;N/A;N/A;The page provides a chronicle of events in Basel-Landschaft for September 2020, covering various topics from energy to social issues.
https://www.baselland.ch/politik-und-behorden/direktionen/bau-und-umweltschutzdirektion/umweltschutz-energie/abfall/industrie-gewerbeabfalle;No;No;No;N/A;N/A;The page provides guidelines on the management of industrial and commercial waste in Basel-Landschaft.
