page_link;page_is_about_software;page_is_software_guide;page_contains_software_guide;type_of_software_guide;page_content
https://www.baselland.ch/politik-und-behorden/direktionen/volkswirtschafts-und-gesundheitsdirektion/amt-fur-gesundheit/gesundheitsforderung/kindheit-und-jugend/archiv/abgeschlossene-projekte/tacco-und-flip/hintergrund?searchterm=anleitung;No;Yes;Yes;Webpage;Provides guidelines for implementing the Tacco & Flip project, focusing on movement and nutrition in schools.
https://www.baselland.ch/politik-und-behorden/direktionen/bildungs-kultur-und-sportdirektion/bildung/handbuch/unterricht/lernkultur/lehrmittel%20volksschule/lehrmittelliste-basel-landschaft?searchterm=anleitung;No;Yes;Yes;PDF;Provides a list of educational materials for teachers, including guidelines for using Excel for sorting and filtering.
https://www.baselland.ch/politik-und-behorden/direktionen/sicherheitsdirektion/zivilrechtsverwaltung/handelsregister/stichworte4?searchterm=anleitung;No;No;Yes;PDF;Provides guidelines and instructions for various legal processes related to the Handelsregister.
https://www.baselland.ch/politik-und-behorden/direktionen/bildungs-kultur-und-sportdirektion/sport/unsere-angebote-und-anlaesse/sportamtag-challenge-1/Teilnahme/smartphone?searchterm=anleitung;Yes;Yes;Yes;Webpage;"Provides instructions for participating in the ""Sport am Tag Challenge"" using a smartphone app, including GPS activation."
https://www.baselland.ch/themen/p/politische-rechte/wahlen/regierungsratswahlen/2019-1?searchterm=anleitung;No;No;No;N/A;Provides information about the 2019 Regierungsratswahlen, including election dates and results.
https://www.baselland.ch/politik-und-behorden/direktionen/finanz-und-kirchendirektion/statistisches-amt/register?searchterm=software;Yes;No;Yes;Webpage;Discusses the kantonalen Gebäude- und Wohnungsregisters (kGWR) and Personenregisters arbo, including software releases and quality assurance.
https://www.baselland.ch/politik-und-behorden/direktionen/bildungs-kultur-und-sportdirektion/dienstleistungen-und-angebote/informatik-schulen-bl/ict-bildung?searchterm=anleitung;Yes;Yes;Yes;Webpage;Focuses on pedagogical ICT support for schools, including guidelines for integrating media and informatics into the curriculum.
https://www.baselland.ch/politik-und-behorden/direktionen/bildungs-kultur-und-sportdirektion/sport/unsere-angebote-und-anlaesse/sportamtag-challenge-1/Teilnahme/GPS%20aktivieren?searchterm=anleitung;Yes;Yes;Yes;Webpage;Data not available.
https://www.baselland.ch/politik-und-behorden/direktionen/bau-und-umweltschutzdirektion/umweltschutz-energie/neobiota2/informationsmaterial-und-merkblaetter?searchterm=anleitung;No;Yes;Yes;Webpage;"Provides guidelines and information materials on invasive species, including an ""InvasivApp"" guide."
