page_link;page_is_about_software;page_is_software_guide;page_contains_software_guide;guide_format;guide_topic;page_content
https://so.ch/startseite/aktuell/news/kantonsrat-fiko-stimmt-verpflichtungskredit-fuer-die-ersatzbeschaffung-der-kantonalen-schulverwaltungssoftware-zu/;Yes;No;Yes;PDF;Education;The page discusses a financial commitment for the replacement of school administration software.
https://so.ch/verwaltung/departement-fuer-bildung-und-kultur/amt-fuer-kultur-und-sport/sportfachstelle/ueber-uns-dienstleistungen/leihmaterial/sofit-anhaenger/;No;No;No;N/A;N/A;The page is about renting a so.fit trailer for sports events.
https://so.ch/verwaltung/departement-des-innern/departementssekretariat/newsletter-ddinside/archiv/ddinside-01-2023/inhaftierte-vaeter-und-ihre-kinder/;No;No;No;N/A;N/A;The page discusses a program for incarcerated fathers to spend quality time with their children.
https://so.ch/verwaltung/finanzdepartement/steueramt/juristische-personen/formulare/formulare-kapitalgesellschaften-genossenschaften/steuererklaerung-2019/;No;No;No;N/A;N/A;The page provides tax forms for corporations and cooperatives for the year 2019.
https://so.ch/startseite/aktuell/news/klimaschutz-kommission-stimmt-massnahmenplan-zu/;No;No;No;N/A;N/A;The page discusses the approval of a climate protection action plan by the UMBAWIKO commission.
https://so.ch/verwaltung/finanzdepartement/personalamt/anstellungsbedingungen-gesamtarbeitsvertrag/versicherung/krankheit/krankentaggeld/;No;No;No;N/A;N/A;The page provides information about sick pay insurance for employees of the Canton of Solothurn.
https://so.ch/verwaltung/finanzdepartement/steueramt/juristische-personen/formulare/formulare-vereine-stiftungen-uebrige/steuererklaerung-2018/;No;No;No;N/A;N/A;The page provides tax forms for associations, foundations, and other legal entities for the year 2018.
